{
  "id": "cexp-001",
  "domain": "Capability",
  "orgUnit": "OU-Finance",
  "targetCoverageLevel": "Analysed",
  "justification": "Required for budgeting accuracy and integration with forecasting process",
  "linkedStrategy": "strat-2025-03",
  "createdBy": "admin@org.com",
  "createdAt": "2025-07-01T10:30:00Z"
}
